{
  "$schema": "https://json-schema.org/draft/2020-12/schema",
  "$id": "https://raw.githubusercontent.com/gowrishankar-infra/sabline-spec/v0.5/schemas/velaris.audit.1.schema.json",
  "title": "sabline.audit/1",
  "description": "What a Sabline program declares, names and promises, before it runs: sabline-spec SPEC.md section 8. Within version 1 fields may be added and consumers must ignore fields they do not know, so no object here forbids other properties; fields added after version 1 was first released (2.52) are optional. This schema checks shape. It does not check the rules of SPEC.md section 8 that JSON Schema cannot state - for example that effects is sorted, or that it is the union of the functions' effects.",
  "type": "object",
  "required": [
    "schema",
    "velaris_version",
    "ok",
    "problems",
    "effects",
    "functions",
    "proven_share",
    "safe_command",
    "warnings"
  ],
  "properties": {
    "schema": {
      "enum": ["sabline.audit/1", "velaris.audit/1"],
      "$comment": "Both names for one format. 0.14.0 renamed the reference implementation from Velaris to Sabline, and a producer writes the sabline.* name; a document written before 0.14.0 carries the velaris.* one, and is the same format at the same version, so a consumer that validates against this schema goes on accepting it. The velaris.* name goes in a version that says so."
    },
    "sabline_version": {
      "description": "The version of the implementation that produced the document.",
      "type": "string",
      "minLength": 1
    },
    "velaris_version": {
      "description": "The name this field had until 0.14.0, when the reference implementation was renamed from Velaris to Sabline. Within version 1 a field may be added and none may disappear, so the new name was added beside this one rather than replacing it: a producer writes both with the same value, a consumer may read either, and this one stays required so that every document written before 0.14.0 is still valid. It goes in a version that says so.",
      "type": "string",
      "minLength": 1
    },
    "ok": {
      "description": "True when the program compiled: it parsed, and the checks made before running - of main, effects, types and proofs - reported no problem. When false, no other field is a bound on anything.",
      "type": "boolean"
    },
    "problems": {
      "type": "array",
      "items": {
        "$ref": "#/$defs/problem"
      }
    },
    "effects": {
      "description": "The union of the declarations of every function defined in the audited file, sorted. An upper bound on the effects a run can attempt when ok is true.",
      "$ref": "#/$defs/effect_list"
    },
    "functions": {
      "description": "One entry per function defined in the audited file, in source order. Inline function values are not listed.",
      "type": "array",
      "items": {
        "$ref": "#/$defs/function"
      }
    },
    "proven_share": {
      "description": "Percent of the functions carrying a requires or ensures whose status is proven, to one decimal; null when no function carries one.",
      "type": [
        "number",
        "null"
      ],
      "minimum": 0,
      "maximum": 100
    },
    "safe_command": {
      "description": "'sabline <file> --allow ' followed by the grant text of SPEC.md section 8.3, or by '' when that is empty. '<file>' is literal text for the reader to replace.",
      "type": "string",
      "pattern": "^sabline <file> --allow .+$"
    },
    "warnings": {
      "description": "Sentences for a human reader. Their wording is not part of the format; do not parse them.",
      "type": "array",
      "items": {
        "type": "string"
      }
    },
    "ffi_modules": {
      "description": "Added in 2.60. Top-level module names given as literal text in the module argument of py, py_int, py_float, py_json and py_new, anywhere in the program as loaded. A module named by a value computed at runtime is absent, and nothing marks that one exists (SPEC.md 8.4).",
      "type": "array",
      "uniqueItems": true,
      "items": {
        "type": "string"
      }
    },
    "loops_unshown": {
      "description": "Added in 2.62. Loops in the audited file whose termination the reference's rule does not show, including loops inside inline function values.",
      "type": "integer",
      "minimum": 0
    },
    "contract_coverage": {
      "description": "Added in 2.62. Functions in the audited file that take or return a List, a Map or a record and carry no requires or ensures.",
      "type": "array",
      "uniqueItems": true,
      "items": {
        "type": "string"
      }
    },
    "fs_paths": {
      "description": "Added in 3.0. Literal path arguments, as written and not resolved: read from read_file and file_exists, write from write_file, anywhere in the program as loaded. read_any and write_any say that some call's path was not a literal.",
      "type": "object",
      "required": [
        "read",
        "write",
        "read_any",
        "write_any"
      ],
      "properties": {
        "read": {
          "type": "array",
          "uniqueItems": true,
          "items": {
            "type": "string"
          }
        },
        "write": {
          "type": "array",
          "uniqueItems": true,
          "items": {
            "type": "string"
          }
        },
        "read_any": {
          "type": "boolean"
        },
        "write_any": {
          "type": "boolean"
        }
      }
    },
    "net_hosts": {
      "description": "Added in 3.0. Hosts named in literal URLs given to fetch, post, fetch_status and request, anywhere in the program as loaded: the host lower-cased with trailing dots removed, or host:port when the URL writes a port. From sabline-lang 3.3.0 an IPv6 host is written in brackets ([::1], [::1]:443), so host:port is unambiguous, and , @ [ ] % in a host are percent-encoded (SPEC.md 5.2, 8.2; Q5 resolved in spec 0.2). any says that some URL was not a literal or had no host.",
      "type": "object",
      "required": [
        "hosts",
        "any"
      ],
      "properties": {
        "hosts": {
          "type": "array",
          "uniqueItems": true,
          "items": {
            "type": "string",
            "minLength": 1
          }
        },
        "any": {
          "type": "boolean"
        }
      }
    },
    "ffi_any": {
      "description": "Added in 4.0. True when the module argument of some py, py_int, py_float, py_json or py_new call, anywhere in the program as loaded, is not a literal: a module named by a value built while running, which ffi_modules cannot list (SPEC.md 8.2, 8.4; Q4 resolved in spec 0.3).",
      "type": "boolean"
    },
    "counts": {
      "description": "Added in 4.2. For fs and net, the largest bound of sabline-spec SPEC.md section 9.4 on the operations of that effect one call to a function defined in the audited file can perform (0 when none of them declares the effect), or null when the text fixes no bound or it exceeds 2^53. The whole field is null when no bound was determined, as when ok is false (SPEC.md 8.2, 8.4).",
      "type": [
        "object",
        "null"
      ],
      "required": [
        "fs",
        "net"
      ],
      "properties": {
        "fs": {
          "type": [
            "integer",
            "null"
          ],
          "minimum": 0
        },
        "net": {
          "type": [
            "integer",
            "null"
          ],
          "minimum": 0
        }
      }
    },
    "prover": {
      "description": "Added in 4.2. True when a prover decided the status of the promises: one was present and the program compiled. When false, no status is proven, and a proven_share of 0 says nothing about what a prover would prove (SPEC.md 8.2).",
      "type": "boolean"
    },
    "confinement": {
      "description": "Added in 0.12 (sabline-lang 8.4). What the operating system holds of a run under safe_command, beside the budget: for each of three systems the level and the reason, stated for a system where every mechanism the producer uses there is available, and the granted Python modules that widen what is asked of the operating system. Derived from the budget alone, so it is the same wherever the audit is made. Null when safe_command's budget does not parse.",
      "type": ["object", "null"],
      "required": ["systems", "widened_by"],
      "properties": {
        "systems": {
          "type": "object",
          "additionalProperties": {
            "type": "object",
            "required": ["level", "reason"],
            "properties": {
              "level": {"enum": ["full", "partial", "none"]},
              "reason": {"type": "string"}
            }
          }
        },
        "widened_by": {
          "type": "array",
          "items": {
            "type": "object",
            "required": ["module", "widens"],
            "properties": {
              "module": {"description": "A top-level Python module the budget grants, or * for plain ffi.", "type": "string", "minLength": 1},
              "widens": {"type": "array", "items": {"enum": ["fs", "net", "all"]}},
              "known": {"description": "False for a module the producer has no entry for, which it treats as all.", "type": "boolean"}
            }
          }
        }
      }
    },
    "ffi_native": {
      "description": "Added in 0.9 (sabline-lang 8.0). Per top-level Python module named in the program (the keys are a subset of ffi_modules), whether it or code it ships is native - a compiled extension (.so/.pyd/.dylib) or a module built into the interpreter - decided from the files on disk WITHOUT importing the module. \"native\" when a compiled extension is found; \"unknown\" otherwise, and never \"false\", because a pure-Python module can import a native one without that being visible from its own files. The verdict reflects the packages installed on the machine that produced the audit, so it is not reproducible across machines and an attestation embedding it says only what that machine found. Empty when the program names no module. A producer without this notion may write it empty or omit it (a consumer must ignore fields it does not know).",
      "type": "object",
      "additionalProperties": {
        "enum": ["native", "unknown"]
      }
    },
    "tools": {
      "description": "Added in 0.13 (sabline-lang 8.5). The tools the program's tool and tool_secret calls name as literal text, and whether any call names one with a value built while running. null when the program could not be loaded.",
      "type": ["object", "null"],
      "required": ["names", "any"],
      "properties": {
        "names": {"type": "array", "items": {"type": "string"}, "uniqueItems": true},
        "any": {"type": "boolean"}
      }
    },
    "secrets": {
      "description": "Added in 0.7 (sabline-lang 6.0). Which builtins handed this program a value the type system will not let it emit, whether the program ever declassifies one, and with what stated reasons (sabline-spec SPEC.md section 8.6). sources holds builtin names, sorted and without repeats - env and read_file_secret in the reference. declassifies is true when the program as loaded holds at least one declassify call, and declassifications names each one, sorted by function, then line, then reason. The whole field is null when the program could not be loaded; it is not null merely because ok is false. An implementation with no such type system writes empty values. The reasons are text a program's author wrote and nothing checks them, and the rule behind the field bounds explicit flow only.",
      "type": [
        "object",
        "null"
      ],
      "required": [
        "sources",
        "declassifies",
        "declassifications"
      ],
      "properties": {
        "sources": {
          "type": "array",
          "uniqueItems": true,
          "items": {
            "type": "string",
            "minLength": 1
          }
        },
        "declassifies": {
          "type": "boolean"
        },
        "declassifications": {
          "type": "array",
          "items": {
            "type": "object",
            "required": [
              "reason",
              "function",
              "line"
            ],
            "properties": {
              "reason": {
                "type": "string"
              },
              "function": {
                "type": "string",
                "minLength": 1
              },
              "line": {
                "type": "integer",
                "minimum": 1
              }
            }
          }
        }
      }
    }
  },
  "$defs": {
    "effect_name": {
      "description": "One of io, env, fs, net, clock, rand, ffi, from sabline-spec 0.7 (sabline-lang 6.0) declassify, and from 0.13 (sabline-lang 8.5) tool. From sabline-lang 3.3.0 the reference rejects any other identifier in a uses clause (SPEC.md 3.2, Q1 resolved in spec 0.2), and from 4.1.0 it leaves such a name out of the audit that reports the rejection too (SPEC.md 3.2, resolved in spec 0.4), so a 4.1+ producer's effects are always a subset of the effects of SPEC.md 3.1; the schema still accepts any identifier so that documents from earlier producers (2.52 onward), which could carry an unknown name, remain valid.",
      "type": "string",
      "pattern": "^[A-Za-z_][A-Za-z0-9_]*$"
    },
    "effect_list": {
      "type": "array",
      "uniqueItems": true,
      "items": {
        "$ref": "#/$defs/effect_name"
      }
    },
    "problem": {
      "type": "object",
      "required": [
        "code",
        "message",
        "line",
        "file",
        "fixes"
      ],
      "properties": {
        "code": {
          "type": "string",
          "pattern": "^E[0-9]{3}$"
        },
        "message": {
          "type": "string"
        },
        "line": {
          "type": "integer",
          "minimum": 0
        },
        "file": {
          "type": "string"
        },
        "fixes": {
          "type": "array",
          "items": {
            "type": "string"
          }
        }
      }
    },
    "function": {
      "type": "object",
      "required": [
        "name",
        "effects",
        "can_fail",
        "requires",
        "ensures",
        "status"
      ],
      "properties": {
        "name": {
          "type": "string",
          "minLength": 1
        },
        "effects": {
          "description": "The function's own declaration, sorted.",
          "$ref": "#/$defs/effect_list"
        },
        "can_fail": {
          "description": "The function is declared 'or fail'.",
          "type": "boolean"
        },
        "requires": {
          "type": "array",
          "items": {
            "type": "string"
          }
        },
        "ensures": {
          "type": "array",
          "items": {
            "type": "string"
          }
        },
        "status": {
          "description": "proven: every promise proven before running (only when a prover ran). checked at runtime: has promises, not all proven. no promises: no requires or ensures. error: a problem was reported on the function's line.",
          "enum": [
            "proven",
            "checked at runtime",
            "no promises",
            "error"
          ]
        },
        "loops_unshown": {
          "description": "Added in 2.62. Loops in this function whose termination is not shown.",
          "type": "integer",
          "minimum": 0
        }
      }
    }
  }
}
